subject,sender,recipient,body,timestamp
Charged twice,ramesh@gmail.com,support@clinic.com,I was charged twice for my appointment last week please help,2026-06-27 09:00
Reschedule appointment,priya@gmail.com,support@clinic.com,Can I reschedule my 3pm appointment to tomorrow?,2026-06-27 09:30
Severe tooth pain,kumar@gmail.com,support@clinic.com,I have severe tooth pain since last night it is unbearable,2026-06-27 10:00
Working hours,anita@gmail.com,support@clinic.com,What are your clinic working hours on weekends?,2026-06-27 10:30
Rude staff,vijay@gmail.com,support@clinic.com,Your receptionist was extremely rude to me today I want to complain,2026-06-27 11:00
